{
  "schema": "pythonhk.submission-request/v2",
  "event_id": "demo-event-2026",
  "repository_id": "123456789",
  "team_id": "22222222-2222-4222-8222-222222222222",
  "attempt_id": "33333333-3333-4333-8333-333333333333",
  "github_id": "101",
  "pr_number": 17,
  "pr_id": "1700000000000000000",
  "fork_repository_id": "987654321",
  "head_owner": "participant",
  "head_branch": "main",
  "head_sha": "0123456789012345678901234567890123456789",
  "bundle_sha256": "replace-at-test-time",
  "eventctl_request": {
    "kind": "submission_envelope",
    "event_id": "demo-event-2026",
    "attempt_id": "33333333-3333-4333-8333-333333333333",
    "actor_id": "101",
    "team_id": "22222222-2222-4222-8222-222222222222",
    "team_proposal_digest": "eeeeeeeeeeeeeeeeeeeeeeeeeeeeeeeeeeeeeeeeeeeeeeeeeeeeeeeeeeeeeeee",
    "base_repository": {"id": "123456789"},
    "pull_request": {"number": 17, "id": "1700000000000000000", "head_repository_id": "987654321", "head_owner": "participant", "head_ref": "main", "head_sha": "0123456789012345678901234567890123456789"},
    "bundle": {"sha256": "replace-at-test-time"},
    "key_id": "aaaaaaaaaaaaaaaaaaaaaaaaaaaaaaaaaaaaaaaaaaaaaaaaaaaaaaaaaaaaaaaa",
    "signature": {"key_id": "aaaaaaaaaaaaaaaaaaaaaaaaaaaaaaaaaaaaaaaaaaaaaaaaaaaaaaaaaaaaaaaa"}
  },
  "issued_at": "2026-08-05T00:00:00Z",
  "expires_at": "2026-08-06T00:00:00Z"
}
